<?xml version="1.0" encoding="UTF-8"?>
<test_data xmlns:xsi="http://www.w3.org/2001/XMLSchema-instance"
	xsi:noNamespaceSchemaLocation="interval.xsd">
	<!-- ****************************************************************** -->
	<!-- ****************************************************************** -->
	<!-- ************************ BASE TEST VALUES ************************ -->
	<!-- ****************************************************************** -->
	<!-- *********************** POSITIVE INTERVALS *********************** -->
	<!-- ****************************************************************** -->
	<!-- ************************ PROPER INTERVALS ************************ -->
	<!-- Common intervals -->
	<data invalid="false">
		<interval>
			<lower_limit>0</lower_limit>
			<upper_limit>1</upper_limit>
		</interval>
	</data>
	<data invalid="false">
		<interval>
			<lower_limit>0</lower_limit>
			<upper_limit>2</upper_limit>
		</interval>
	</data>
	<data invalid="false">
		<interval>
			<lower_limit>1</lower_limit>
			<upper_limit>2</upper_limit>
		</interval>
	</data>
	<data invalid="false">
		<interval>
			<lower_limit>0</lower_limit>
			<upper_limit>3</upper_limit>
		</interval>
	</data>
	<data invalid="false">
		<interval>
			<lower_limit>1</lower_limit>
			<upper_limit>3</upper_limit>
		</interval>
	</data>
	<data invalid="false">
		<interval>
			<lower_limit>0</lower_limit>
			<upper_limit>4</upper_limit>
		</interval>
	</data>
	<data invalid="false">
		<interval>
			<lower_limit>1</lower_limit>
			<upper_limit>4</upper_limit>
		</interval>
	</data>
	<data invalid="false">
		<interval>
			<lower_limit>0</lower_limit>
			<upper_limit>5</upper_limit>
		</interval>
	</data>
	<data invalid="false">
		<interval>
			<lower_limit>1</lower_limit>
			<upper_limit>5</upper_limit>
		</interval>
	</data>
	<data invalid="false">
		<interval>
			<lower_limit>0</lower_limit>
			<upper_limit>6</upper_limit>
		</interval>
	</data>
	<data invalid="false">
		<interval>
			<lower_limit>1</lower_limit>
			<upper_limit>6</upper_limit>
		</interval>
	</data>
	<data invalid="false">
		<interval>
			<lower_limit>0</lower_limit>
			<upper_limit>8</upper_limit>
		</interval>
	</data>
	<data invalid="false">
		<interval>
			<lower_limit>1</lower_limit>
			<upper_limit>8</upper_limit>
		</interval>
	</data>
	<data invalid="false">
		<interval>
			<lower_limit>0</lower_limit>
			<upper_limit>10</upper_limit>
		</interval>
	</data>
	<data invalid="false">
		<interval>
			<lower_limit>1</lower_limit>
			<upper_limit>10</upper_limit>
		</interval>
	</data>
	<data invalid="false">
		<interval>
			<lower_limit>0</lower_limit>
			<upper_limit>12</upper_limit>
		</interval>
	</data>
	<data invalid="false">
		<interval>
			<lower_limit>1</lower_limit>
			<upper_limit>12</upper_limit>
		</interval>
	</data>
	<data invalid="false">
		<interval>
			<lower_limit>0</lower_limit>
			<upper_limit>20</upper_limit>
		</interval>
	</data>
	<data invalid="false">
		<interval>
			<lower_limit>1</lower_limit>
			<upper_limit>20</upper_limit>
		</interval>
	</data>
	<data invalid="false">
		<interval>
			<lower_limit>0</lower_limit>
			<upper_limit>100</upper_limit>
		</interval>
	</data>
	<data invalid="false">
		<interval>
			<lower_limit>1</lower_limit>
			<upper_limit>100</upper_limit>
		</interval>
	</data>
	<!-- Successions -->
	<data invalid="false">
		<interval>
			<lower_limit>2</lower_limit>
			<upper_limit>3</upper_limit>
		</interval>
	</data>
	<data invalid="false">
		<interval>
			<lower_limit>3</lower_limit>
			<upper_limit>4</upper_limit>
		</interval>
	</data>
	<data invalid="false">
		<interval>
			<lower_limit>4</lower_limit>
			<upper_limit>5</upper_limit>
		</interval>
	</data>
	<data invalid="false">
		<interval>
			<lower_limit>3</lower_limit>
			<upper_limit>10</upper_limit>
		</interval>
	</data>
	<data invalid="false">
		<interval>
			<lower_limit>4</lower_limit>
			<upper_limit>10</upper_limit>
		</interval>
	</data>
	<data invalid="false">
		<interval>
			<lower_limit>5</lower_limit>
			<upper_limit>10</upper_limit>
		</interval>
	</data>
	<!-- Boundary -->
	<data invalid="false">
		<interval>
			<lower_limit>0</lower_limit>
			<upper_limit>2147483646</upper_limit>
		</interval>
	</data>
	<data invalid="false">
		<interval>
			<lower_limit>1</lower_limit>
			<upper_limit>2147483646</upper_limit>
		</interval>
	</data>
	<data invalid="false">
		<interval>
			<lower_limit>100</lower_limit>
			<upper_limit>2147483646</upper_limit>
		</interval>
	</data>
	<!-- ****************************************************************** -->
	<!-- ********************** NOT PROPER INTERVALS ********************** -->
	<data invalid="false">
		<interval>
			<lower_limit>0</lower_limit>
			<upper_limit>0</upper_limit>
		</interval>
	</data>
	<data invalid="false">
		<interval>
			<lower_limit>1</lower_limit>
			<upper_limit>1</upper_limit>
		</interval>
	</data>
	<data invalid="false">
		<interval>
			<lower_limit>2</lower_limit>
			<upper_limit>2</upper_limit>
		</interval>
	</data>
	<data invalid="false">
		<interval>
			<lower_limit>3</lower_limit>
			<upper_limit>3</upper_limit>
		</interval>
	</data>
	<data invalid="false">
		<interval>
			<lower_limit>4</lower_limit>
			<upper_limit>4</upper_limit>
		</interval>
	</data>
	<data invalid="false">
		<interval>
			<lower_limit>6</lower_limit>
			<upper_limit>6</upper_limit>
		</interval>
	</data>
	<data invalid="false">
		<interval>
			<lower_limit>8</lower_limit>
			<upper_limit>8</upper_limit>
		</interval>
	</data>
	<data invalid="false">
		<interval>
			<lower_limit>10</lower_limit>
			<upper_limit>10</upper_limit>
		</interval>
	</data>
	<data invalid="false">
		<interval>
			<lower_limit>12</lower_limit>
			<upper_limit>12</upper_limit>
		</interval>
	</data>
	<data invalid="false">
		<interval>
			<lower_limit>20</lower_limit>
			<upper_limit>20</upper_limit>
		</interval>
	</data>
	<data invalid="false">
		<interval>
			<lower_limit>100</lower_limit>
			<upper_limit>100</upper_limit>
		</interval>
	</data>
	<data invalid="false">
		<interval>
			<lower_limit>2147483646</lower_limit>
			<upper_limit>2147483646</upper_limit>
		</interval>
	</data>
	<!-- ****************************************************************** -->
	<!-- *********************** NEGATIVE INTERVALS *********************** -->
	<!-- ****************************************************************** -->
	<!-- ************************ PROPER INTERVALS ************************ -->
	<data invalid="false">
		<interval>
			<lower_limit>-1</lower_limit>
			<upper_limit>0</upper_limit>
		</interval>
	</data>
	<data invalid="false">
		<interval>
			<lower_limit>-2</lower_limit>
			<upper_limit>-1</upper_limit>
		</interval>
	</data>
	<data invalid="false">
		<interval>
			<lower_limit>-3</lower_limit>
			<upper_limit>-2</upper_limit>
		</interval>
	</data>
	<data invalid="false">
		<interval>
			<lower_limit>-4</lower_limit>
			<upper_limit>-3</upper_limit>
		</interval>
	</data>
	<data invalid="false">
		<interval>
			<lower_limit>-5</lower_limit>
			<upper_limit>-4</upper_limit>
		</interval>
	</data>
	<data invalid="false">
		<interval>
			<lower_limit>-10</lower_limit>
			<upper_limit>0</upper_limit>
		</interval>
	</data>
	<data invalid="false">
		<interval>
			<lower_limit>-10</lower_limit>
			<upper_limit>-1</upper_limit>
		</interval>
	</data>
	<data invalid="false">
		<interval>
			<lower_limit>-10</lower_limit>
			<upper_limit>-2</upper_limit>
		</interval>
	</data>
	<data invalid="false">
		<interval>
			<lower_limit>-10</lower_limit>
			<upper_limit>-4</upper_limit>
		</interval>
	</data>
	<data invalid="false">
		<interval>
			<lower_limit>-10</lower_limit>
			<upper_limit>-5</upper_limit>
		</interval>
	</data>
	<data invalid="false">
		<interval>
			<lower_limit>-2147483648</lower_limit>
			<upper_limit>0</upper_limit>
		</interval>
	</data>
	<data invalid="false">
		<interval>
			<lower_limit>-2147483648</lower_limit>
			<upper_limit>-1</upper_limit>
		</interval>
	</data>
	<data invalid="false">
		<interval>
			<lower_limit>-2147483648</lower_limit>
			<upper_limit>-100</upper_limit>
		</interval>
	</data>
	<!-- ****************************************************************** -->
	<!-- ********************** NOT PROPER INTERVALS ********************** -->
	<data invalid="false">
		<interval>
			<lower_limit>-1</lower_limit>
			<upper_limit>-1</upper_limit>
		</interval>
	</data>
	<data invalid="false">
		<interval>
			<lower_limit>-2</lower_limit>
			<upper_limit>-2</upper_limit>
		</interval>
	</data>
	<data invalid="false">
		<interval>
			<lower_limit>-3</lower_limit>
			<upper_limit>-3</upper_limit>
		</interval>
	</data>
	<data invalid="false">
		<interval>
			<lower_limit>-10</lower_limit>
			<upper_limit>-10</upper_limit>
		</interval>
	</data>
	<data invalid="false">
		<interval>
			<lower_limit>-100</lower_limit>
			<upper_limit>-100</upper_limit>
		</interval>
	</data>
	<data invalid="false">
		<interval>
			<lower_limit>-2147483648</lower_limit>
			<upper_limit>-2147483648</upper_limit>
		</interval>
	</data>
	<!-- ****************************************************************** -->
	<!-- ********************** BOTH SIDES INTERVALS ********************** -->
	<!-- ****************************************************************** -->
	<!-- ************************ PROPER INTERVALS ************************ -->
	<data invalid="false">
		<interval>
			<lower_limit>-1</lower_limit>
			<upper_limit>1</upper_limit>
		</interval>
	</data>
	<data invalid="false">
		<interval>
			<lower_limit>-1</lower_limit>
			<upper_limit>10</upper_limit>
		</interval>
	</data>
	<data invalid="false">
		<interval>
			<lower_limit>-10</lower_limit>
			<upper_limit>1</upper_limit>
		</interval>
	</data>
	<data invalid="false">
		<interval>
			<lower_limit>-5</lower_limit>
			<upper_limit>10</upper_limit>
		</interval>
	</data>
	<data invalid="false">
		<interval>
			<lower_limit>-10</lower_limit>